id,title,text,created_at,score,num_comments,upvote_ratio,subreddit,author,is_post,source,url
1j8qslh,Top 4 AI Coding Tools Offering Specialized Development Support,"For developers seeking tools that go beyond generic AI assistance, here are four platforms which I have tested that offer specialized coding support in no particular order: 

* [BlackBox AI](https://www.blackbox.ai/): Designed specifically for coding, it provides hands-on assistance with smart code completions, full-stack app generation, and automation across diverse projects. 
* [Cursor](https://www.cursor.com/): A VS Code-based tool with AI-driven suggestions, ideal for real-time coding support and multi-file edits. 
* [Windsurf](https://codeium.com/windsurf): Focuses on intuitive UI and autonomous coding help, with strong context awareness for developers. 
* [Replit](https://replit.com/): Combines an IDE with AI agents, emphasizing execution and collaborative coding environments. 

Have you used or integrated any of these tools into your workflow? 

As a tech enthusiast who’s tested dozens of AI coding platforms, feel free to ask me anything in the comments! :)",2025-03-11 06:31:01,49,6,0.86,webdev,CreepToeCurrentSea,True,Reddit (r/webdev),https://www.reddit.com/r/webdev/comments/1j8qslh/top_4_ai_coding_tools_offering_specialized/
1j5z69o,Which IDE do you use?,"I see lots of people using Cursor and Windsurf now. Are these better than using Github Copilot on PHPStorm or VS Code?

Which one do you use for web development?",2025-03-07 12:19:02,55,216,0.76,webdev,Euphoric_Natural_304,True,Reddit (r/webdev),https://www.reddit.com/r/webdev/comments/1j5z69o/which_ide_do_you_use/
mglmqtw,,"I rarely change my ide. Once I learned all the shortcuts and specifics, I don't really want to switch. I went from notepad++ in my very early we dev days, moved to atom and used it past the time it was discontinued, used pycharms on the side, tried webstorm, got stuck with VSCode for the longest time and now I'm on cursor. The AI part is a nice to have, but even without it it's still VSCode, so I'm used to it. Maybe in a few years I'll move on, but right now it's the perfect match of language agnosticism and functionality. I heard a lot of (AI specific) good things about windsurf, but I don't see a good reason to move yet, as I'm not depending on the AI stuff. Occasionally it's a good thing to have, most of the time it gets into my way, so VSCode or VSCodium for me.",2025-03-07 15:54:54,1,0,0.0,webdev,perskes,False,Reddit (r/webdev),https://www.reddit.com/r/webdev/comments/1j5z69o/which_ide_do_you_use/mglmqtw/
mgmqwv1,,"VSCode with bunch of extensions = Multiple IDEs in one place.

For extra: Im using Codeium as AI, which is not reading/training over your code (I value privacy) and does a good job for autocompleting the logic.",2025-03-07 20:00:40,1,0,0.0,webdev,mmzeynalli,False,Reddit (r/webdev),https://www.reddit.com/r/webdev/comments/1j5z69o/which_ide_do_you_use/mgmqwv1/
mgnj0qd,,"Came from Sublime Text, now on VS Code for years, with some AI support from Codeium",2025-03-08 00:03:07,1,0,0.0,webdev,bram_chi,False,Reddit (r/webdev),https://www.reddit.com/r/webdev/comments/1j5z69o/which_ide_do_you_use/mgnj0qd/
mgt752m,,"I can only use VS Code at work. 

I work with Rails primarily so I have also used RubyMine in the past. 

On my personal machine I use vs code but currently using Codeium as an assistant; I don’t code too much on my personal time and didn’t think paying $10 monthly for copilot was worth it. 

The same goes for RubyMine (on personal machine). Additionally, it was too heavy on my M1 Air, but I think it’s a fantastic IDE. If I ever freelance, I’d like a Linux laptop with tons of RAM and I’d try RubyMine again. 

I’m interested in trying Zed but I don’t think Rails support is very deep. ",2025-03-08 21:52:15,1,0,0.0,webdev,here_for_code,False,Reddit (r/webdev),https://www.reddit.com/r/webdev/comments/1j5z69o/which_ide_do_you_use/mgt752m/
mglpnjq,,Is that like Codeium?,2025-03-07 16:11:39,2,0,0.0,webdev,barrard123,False,Reddit (r/webdev),https://www.reddit.com/r/webdev/comments/1j5z69o/which_ide_do_you_use/mglpnjq/
mgmbzpk,,Codeium still the best to me. Did people stop using it?,2025-03-07 18:23:44,2,0,0.0,webdev,entinio,False,Reddit (r/webdev),https://www.reddit.com/r/webdev/comments/1j5z69o/which_ide_do_you_use/mgmbzpk/
mglqtnw,,"Yeah kinda but different approach, In their Free tiers:
- Codeium has amazing chat + completion + more.
- Supermaven just has completion (which is blazingly fast).

I also found Supermaven to be the lightest one (faster than GH Copilot itself).",2025-03-07 16:18:20,0,0,0.0,webdev,noobjaish,False,Reddit (r/webdev),https://www.reddit.com/r/webdev/comments/1j5z69o/which_ide_do_you_use/mglqtnw/
1j78dt7,Completely Free alternative to Cursor or Windsurf or similar?,Ive tried using Cline w olama w deepseek in visual studio but it didnt work,2025-03-09 07:08:36,1,2,0.67,AskProgramming,jlhlckcmcmlx,True,Reddit (r/AskProgramming),https://www.reddit.com/r/AskProgramming/comments/1j78dt7/completely_free_alternative_to_cursor_or_windsurf/
1j9eott,Anyone else having issues with Windsurf editing files?,"Tonight I started having bugs where, during Cascade, Windsurf would fail to edit the file, trying over and over in an endless loop of utility. It has happened with multiple files, and burned a bunch of credits in the process. Might be a bug?",2025-03-12 00:38:57,54,56,0.95,Codeium,OofWhyAmIOnReddit,True,Reddit (r/Codeium),https://www.reddit.com/r/Codeium/comments/1j9eott/anyone_else_having_issues_with_windsurf_editing/
mhd9mzi,,Same here ... can't get any work done.   Windsurf cannot edit any files without tool errors.    Everyone should petition a version rollback feature so that we can rollback Windsurf to a previous stable install ... this is far more important than any new bells or whistles they can add.,2025-03-12 04:36:13,12,0,0.0,Codeium,Nixxorian,False,Reddit (r/Codeium),https://www.reddit.com/r/Codeium/comments/1j9eott/anyone_else_having_issues_with_windsurf_editing/mhd9mzi/
mhefnia,,"Hey everyone,

If you’re using a Mac, you can check Homebrew’s history to roll back to earlier versions. Take a look at this file:

https://github.com/Homebrew/homebrew-cask/commit/5e941006c2e2f497d3468e2a95508e236d65d8f1#diff-d1f453388cf5a4755f42a952c38c10d2bf7de3b6481405f5a2c5425148fd8e99

From the Ruby code, we can see that the version is 1.3.10, and the URL is defined in the code. You can simply use that URL to download the DMG file and disable auto-updates.
For Apple Silicon (arm64) Mac: 

https://windsurf-stable.codeiumdata.com/darwin-arm64-dmg/stable/0f80b7c19f8b1378a97a1304da23b6b06e767db0/Windsurf-darwin-arm64-1.3.11.dmg",2025-03-12 08:39:57,3,0,0.0,Codeium,htlin222,False,Reddit (r/Codeium),https://www.reddit.com/r/Codeium/comments/1j9eott/anyone_else_having_issues_with_windsurf_editing/mhefnia/
mhd641j,,I haven’t used windsurf in a while. Hope we get a stable build soon that works well.,2025-03-12 04:07:27,2,0,0.0,Codeium,VinylSeller2017,False,Reddit (r/Codeium),https://www.reddit.com/r/Codeium/comments/1j9eott/anyone_else_having_issues_with_windsurf_editing/mhd641j/
mhe8nqg,,"YES!  It's extremely frustrating.  Though I will give Cascade credit... It got very creative with work-arounds by creating scripts to edit files, creating new files with the edits, and then oddly being able to transfer the changes from the new temp file back over to the original, etc... But damn, my coding session took 2-3X as long and even though Flow Credits aren't used when Cascade, or the tool call to edit files files... All the work arounds and ""fixes"" to get the work done definitely used up 2-3X the Flow Credits.  I sent in a detailed report with about a dozen screenshots to Codeium Support.  Let's hope they fix it SOON!  It's absolutely GREAT to have all the new features in Windsurf not to mention access to the plethora of LLMs...  But damn... An IDE that can't edit files?  That's not just mission critical... That's mission failure.  : /",2025-03-12 08:05:11,2,0,0.0,Codeium,CPT_IDOL,False,Reddit (r/Codeium),https://www.reddit.com/r/Codeium/comments/1j9eott/anyone_else_having_issues_with_windsurf_editing/mhe8nqg/
mhe90t9,,"Windsurf support is terrible too with thei AI generated answers, leading nowhere !!",2025-03-12 08:07:01,2,0,0.0,Codeium,Excellent-Doctor-402,False,Reddit (r/Codeium),https://www.reddit.com/r/Codeium/comments/1j9eott/anyone_else_having_issues_with_windsurf_editing/mhe90t9/
mhdb7yd,,"I sent an error message to support. 

From my observations it is an error between Cascade in edit mode and the LLMs output, as the proposal mode seems to be working just fine. 

Perhaps Codeium are doing changes to the code? :P",2025-03-12 04:48:18,1,0,0.0,Codeium,DetDerBorte,False,Reddit (r/Codeium),https://www.reddit.com/r/Codeium/comments/1j9eott/anyone_else_having_issues_with_windsurf_editing/mhdb7yd/
mhdq5a9,,try with a new chat.. it will edit files then. I was having the same problem with deepseek on windsurf.. after much yelling and cursing I tried with a new chat and it edited the files. Though I had to explain the scenario again in the new chat,2025-03-12 06:25:45,1,0,0.0,Codeium,Natural-Duty2,False,Reddit (r/Codeium),https://www.reddit.com/r/Codeium/comments/1j9eott/anyone_else_having_issues_with_windsurf_editing/mhdq5a9/
mhdwegl,,"same ... It is getting more frustrating every time, I used to prefer windsurf over cursor but more and more cursor feels more reliable and stable. Codeium needs members in EU or something where they could restart the services or servers, cause we have to wait for US team to wake up for a fix everytime",2025-03-12 07:00:01,1,0,0.0,Codeium,LowPaleontologist10,False,Reddit (r/Codeium),https://www.reddit.com/r/Codeium/comments/1j9eott/anyone_else_having_issues_with_windsurf_editing/mhdwegl/
mhem4de,,"Same here. All of a sudden, cascade is not able to edit files anymore. 

In general, I recommend making full backups after EACH successful edit to a stable stage of your application before continuing editing - this might happen again from update to update. If windsurf screws up the next step, copy the backup version and try again. always add a sentence like ""don't mess up any existing functionality"".

Fortunately, no credits are consumed, i've been working last night when the editing errors started to occur.",2025-03-12 09:11:17,1,0,0.0,Codeium,No-Detail2332,False,Reddit (r/Codeium),https://www.reddit.com/r/Codeium/comments/1j9eott/anyone_else_having_issues_with_windsurf_editing/mhem4de/
mhepyw3,,"bought windsuft pro like 3-4 days ago, before today it was fine, with this cascade errors it wasn't worth try with it. At least codium should have something like downdetector. I'm not using windsurf until this errors are gone. (BUT WHEN, would they notify us when they handle issues?)",2025-03-12 09:29:50,1,0,0.0,Codeium,ManuelCalavera_,False,Reddit (r/Codeium),https://www.reddit.com/r/Codeium/comments/1j9eott/anyone_else_having_issues_with_windsurf_editing/mhepyw3/
mhf5ynb,,Yes this happens to me. I gave up on Windsurf and moved back to Cursor. The constant issues and burning through $10 fees per week was enough for me. I had high hopes and did like it when it worked.,2025-03-12 10:45:41,1,0,0.0,Codeium,tank_of_happiness,False,Reddit (r/Codeium),https://www.reddit.com/r/Codeium/comments/1j9eott/anyone_else_having_issues_with_windsurf_editing/mhf5ynb/
mhg0kvz,,"I just got an email back from the Codeium Support Team that the edit file tool call has been fixed now.

I haven't tested it yet... Will do later. Hope it works for you now. Thanks Codeium!  Happy Coding!",2025-03-12 13:11:08,1,0,0.0,Codeium,CPT_IDOL,False,Reddit (r/Codeium),https://www.reddit.com/r/Codeium/comments/1j9eott/anyone_else_having_issues_with_windsurf_editing/mhg0kvz/
mhe51be,,"# !!! SOLVED !!!

Caveat: likely not work for anyone else - Sorry

I had this happen to me today, the write\_file tool worked fine, but the edit\_file tool failed everytime.  
The error is consistent: ""incomplete envelope"" from [192.34.20.166:443](http://192.34.20.166:443)

If I made a new file, no issue, and I could then move it around, but this also BURNED down my flow credits.

They showed up as ReparsePoint in my filesystem:

    Name                    LastWriteTime                  Attributes
    ----                    -------------                  ----------
    test_email_ingestion.py 12-03-2025 12:24:13 Archive, ReparsePoint
    interface.py            12-03-2025 13:27:09 Archive, ReparsePoint

Solution for me was to not have the files live in a dropbox folder, and move them to a ""simple"" folder.

I got it all moved over the a simple folder, and then it worked fine for me immediately.

Wanted to set up a automated self-hosted Gitlab in WSL, but then I ran out of flow credits and now I am seriously thinking I should just do it manually like a common coder :D

I was to be honest leaning on Windsurf to do things that I could just as easily do myself, so I guess it is fair I lost all of my credits.

https://preview.redd.it/1l7rn5tqt9oe1.png?width=1611&format=png&auto=webp&s=a922d0b0321d58fb745bfa261a52bd06eb56aa6a

But I am certain that my mind will have forgotten all of this by the time my credits roll around.

Might as well just cancel it now and take the win that using this for 3 days was... Wild ride, but since I can't get around the credits by self-hosting and I am not made of money, I will just step off the subscription here, thanks.",2025-03-12 07:46:08,1,0,0.0,Codeium,Stoisss,False,Reddit (r/Codeium),https://www.reddit.com/r/Codeium/comments/1j9eott/anyone_else_having_issues_with_windsurf_editing/mhe51be/
mhenosi,,Support E-Mail reply of Codeium?,2025-03-12 09:18:54,1,0,0.0,Codeium,No-Detail2332,False,Reddit (r/Codeium),https://www.reddit.com/r/Codeium/comments/1j9eott/anyone_else_having_issues_with_windsurf_editing/mhenosi/
mherx9o,,"I feel your pain... I got the somewhat canned response from my support request to Codeium that basically reiterated that ""No AI coding tool is perfect..."" and that no credits were used on errors like this... I replied back with an even firmer response basically letting them know that for Premium Plus customers at $60+ a month, we need a better response and some sort of compensation.  You know what they say though... Don't hold your breath on that... It will only make you blue.  : / 

I have no doubt they'll fix the edit file tool call, but damn... We'll probably not see any satisfaction on the customer sat issue.  Will continue to look for new and better alternatives.  And that's sad too. ;(",2025-03-12 09:39:09,3,0,0.0,Codeium,CPT_IDOL,False,Reddit (r/Codeium),https://www.reddit.com/r/Codeium/comments/1j9eott/anyone_else_having_issues_with_windsurf_editing/mherx9o/
mhg07x3,,"I just got an email back from the Codeium Support Team that the edit file tool call has been fixed now.

They apologized for the inconvenience... But of course, didn't address the underlying customer sat issue.   Go figure.  : / 

I haven't tested it yet... Will do later.  Hope it works for you now.  Happy Coding!",2025-03-12 13:09:26,1,0,0.0,Codeium,CPT_IDOL,False,Reddit (r/Codeium),https://www.reddit.com/r/Codeium/comments/1j9eott/anyone_else_having_issues_with_windsurf_editing/mhg07x3/
1j4w8do,Windsurf just got unusable for me with the latest update,"Windsurf just got unusable for me with the latest update. It edits the code, then analyzes it, then edits again, and so on 10 times or so in circles. It's just super overcomplicating things and removing its own code.

Has anyone else experienced this? Any solutions or workarounds you've found? I really liked using Windsurf before, but this circular editing loop makes it completely unusable now.",2025-03-06 06:07:56,51,50,0.92,Codeium,Adept_Bedroom5224,True,Reddit (r/Codeium),https://www.reddit.com/r/Codeium/comments/1j4w8do/windsurf_just_got_unusable_for_me_with_the_latest/
mgc80ni,,"It only happens when I try to make big changes on big files, with fairly generic prompts, with some premium models.


For example, if I ask for a change that involves editing 5-6 big files, any model will do a disaster, premium or non-premium...but premium models will go into a ""edit this file...no wait I made a mistake, I'll edit again...no wait, I'll edit again..."" loop and at the end of the loop it's all wrong anyway.


Cascade Base simply refuses to do too many changes and you have to do 1 at a time.


If I ask for small, targeted changes with very precise instructions, Cascade Base works so well that I don't even use the other models.


I occasionally ask Claude 3.5 to optimize my code written by Cascade Base, nothing more.


I'm not an experienced developer and I don't know what you're using Windsurf for, but I'm trying to develop a gui audio/midi application, in C++20, interfacing only with the Windows API. It's working fine.
I'm still at the beginning of the project and I've already taken into account that when the project becomes complex, I will start to encounter many more problems... But for now it is allowing me to achieve things that I would not be able to achieve alone.",2025-03-06 07:07:13,3,0,0.0,Codeium,Agrume303,False,Reddit (r/Codeium),https://www.reddit.com/r/Codeium/comments/1j4w8do/windsurf_just_got_unusable_for_me_with_the_latest/mgc80ni/
mgg3ktw,,Posts like this pop up like mushrooms after rain with every update. Damn Codeium.,2025-03-06 18:58:01,4,0,0.0,Codeium,chocoboxx,False,Reddit (r/Codeium),https://www.reddit.com/r/Codeium/comments/1j4w8do/windsurf_just_got_unusable_for_me_with_the_latest/mgg3ktw/
mgcp24u,,"Been dealing with this nonstop since wave 4. I have tried different models, logging out and logging back in, rebooting, restarting. I have also experienced this on VERY simple UI changes that I was deliberately testing it to see if it would get into the loop/ I also have seen it for bigger issues. 

I switched over to cursor but found that I still missed Windsurf and came back and am just cutting it off in the loop and trying to use what it suggests. Its still creating an insane amount of issues and I think drained about 400 credits since the update and all I am doing is troubleshooting code broken by the cycle.",2025-03-06 08:30:03,2,0,0.0,Codeium,lakeoffury,False,Reddit (r/Codeium),https://www.reddit.com/r/Codeium/comments/1j4w8do/windsurf_just_got_unusable_for_me_with_the_latest/mgcp24u/
mgdkak0,,Same for me. Also the code for some reason is shown in black background with very dark letters (in light mode). Codeium extension also is laggy and gives errors.,2025-03-06 10:55:59,2,0,0.0,Codeium,thlpap,False,Reddit (r/Codeium),https://www.reddit.com/r/Codeium/comments/1j4w8do/windsurf_just_got_unusable_for_me_with_the_latest/mgdkak0/
mgequg1,,"Prove me wrong.  
Cline would be able to do any task easily, as long if your prompt makes sense. It can edit your ENTIRE codebase with no problem. Windsurf can NEVER match Cline.

1 question. Why is there an INSANE difference between Claude 3.7 Cascade and Claude 3.7 Cline? BOTH USE THE SAME MODEL. I'd rather use the free models provided by Cline, and use Codeium's extension for in-code edits.

**Literally free, MUCH BETTER, and you're on VSC, instead of a fishy IDE.**",2025-03-06 14:15:39,2,0,0.0,Codeium,mysterioususer2866,False,Reddit (r/Codeium),https://www.reddit.com/r/Codeium/comments/1j4w8do/windsurf_just_got_unusable_for_me_with_the_latest/mgequg1/
mgbz1hl,,"I too am experiencing this as well... More often than not it just errors out and can't create simple python files in the project workspace, then it can't edit them, but sometimes it will, over and over and over again... It's great that it doesn't use Flow Credits when it errors out, but damn... You're not getting much done either.  I just canceled my Pro Ultimate plan, and am looking at other tools at this point.  You might look up TRAE... Right now, like WS was in the beginning it's still free, and with Claude 3.7 no less... It's sad, I've been with Codeium and WS from the beginning, and it's  really leveled up my skills and productivity initially... But over the last several months, it's just gotten worse and worse even though they keep adding seemingly great features... Sometimes they work, sometimes they don't, sometimes Cascade is GREAT... Most of the time it just sucks now.  I think it might be time to move on, unless they really start listening to users like us.  But... You know what they say, don't hold your breath, it'll only make you blue. : /",2025-03-06 06:20:17,1,0,0.0,Codeium,CPT_IDOL,False,Reddit (r/Codeium),https://www.reddit.com/r/Codeium/comments/1j4w8do/windsurf_just_got_unusable_for_me_with_the_latest/mgbz1hl/
mgc91vz,,Using 3.7? Haven’t used Windsurf in a while but recent Cursor releases have been an absolute disaster with 3.7. They’ve been scrambling to ship patches and damage control but I think a lot of users have bounced. Copilot is great with 3.7. I think their more conservative approach is a better fit with that model (which is like an adderall crazed intern with adhd). System prompting with 3.7 should endeavor to constrain as much as possible and the “thinking” version should be avoided entirely for most tasks. I think Codeium and Cursor have learned this the hard way.,2025-03-06 07:12:22,1,0,0.0,Codeium,Parabola2112,False,Reddit (r/Codeium),https://www.reddit.com/r/Codeium/comments/1j4w8do/windsurf_just_got_unusable_for_me_with_the_latest/mgc91vz/
mhbe204,,"I've had nothing but issues with the latest update. Regardless of which model I use, it loses context very quickly. It forgets the system prompts and directives and sends me on a wild goose chases. WindSurf is pretty much unusable for m. The product is costing me both in time and money, it's not helping at all. Considering I'm Pro Ultimate, I've go through all my flow credits play 600 additional credits in a matter of a couple of days. I've now just experienced a 503 error trying to login. I know about context and prompt engineering.",2025-03-11 18:55:36,1,0,0.0,Codeium,digitalvortex66,False,Reddit (r/Codeium),https://www.reddit.com/r/Codeium/comments/1j4w8do/windsurf_just_got_unusable_for_me_with_the_latest/mhbe204/
mhd9wl3,,Same problem here ... can't get any work done.   Windsurf cannot edit any files without tool errors or getting caught in a loop.    Everyone should petition a version rollback feature so that we can rollback Windsurf to a previous stable install ... this is far more important than any new bells or whistles they can add.,2025-03-12 04:38:17,1,0,0.0,Codeium,Nixxorian,False,Reddit (r/Codeium),https://www.reddit.com/r/Codeium/comments/1j4w8do/windsurf_just_got_unusable_for_me_with_the_latest/mhd9wl3/
mgehbxo,,"Same, it looped through the same response 5 times in a row just now for me.

Windsurf would be so great but the tools calling and flow credit system makes it absolutely unusable.",2025-03-06 13:30:09,1,0,0.0,Codeium,deno0211,False,Reddit (r/Codeium),https://www.reddit.com/r/Codeium/comments/1j4w8do/windsurf_just_got_unusable_for_me_with_the_latest/mgehbxo/
mger6w5,,"And also, stop watching those youtube videos that creators post. They're sponsored.  
""WAVE 3 WINDSURF IS ACTUALLY INSANE?!""  
""WINDSURF REPLACED CURSOR WITH WAVE 3!!""

Please, stop.",2025-03-06 14:17:19,1,0,0.0,Codeium,mysterioususer2866,False,Reddit (r/Codeium),https://www.reddit.com/r/Codeium/comments/1j4w8do/windsurf_just_got_unusable_for_me_with_the_latest/mger6w5/
mghkay1,,"Trae is… not near as smart as Windsurf - and it will throttle your credits FAST. It tries to match Cursor by indexing your projects, just isn’t as refined. Also, can’t use MCP Servers. Kind of reminds me of Aide.

One thing that can save credits is using the filesystem MCP Server, especially to read files on your PC. If you’re having trouble installing it, ask Cascade to install it for you. Then set a rule in Cascade’s global rules to use filesystem’s read_file tool, instead of making API calls to read files. Using the write_file tool is a bit trickier and you’ll have to do some trial and error, if you feel comfortable with that.",2025-03-07 02:11:17,2,0,0.0,Codeium,captainspazlet,False,Reddit (r/Codeium),https://www.reddit.com/r/Codeium/comments/1j4w8do/windsurf_just_got_unusable_for_me_with_the_latest/mghkay1/
mgcjoqz,,"Nope, never mind. Windsurf is cooked right now. Nothing can be done until they fix it. They rushed to get Claude 3.7 integrated into their product without running tests first.",2025-03-06 08:03:27,2,0,0.0,Codeium,WhoWantsSmoke_,False,Reddit (r/Codeium),https://www.reddit.com/r/Codeium/comments/1j4w8do/windsurf_just_got_unusable_for_me_with_the_latest/mgcjoqz/
mghz9ov,,"Niice great idea! Followed your steps & feel moderately avenged after last 12hrs battling same Codeium bugs folks reporting here & burning through credits with Claude 3.7 ... thank you u/captainspazlet ! *""save credits... using the filesystem MCP Server, especially to read files on your PC... ask Cascade to install it for you. Then \[ask to\] set a rule in Cascade’s global rules to use filesystem’s read\_file tool, instead of making API calls to read files""*",2025-03-07 04:24:04,1,0,0.0,Codeium,EmergencyFew7928,False,Reddit (r/Codeium),https://www.reddit.com/r/Codeium/comments/1j4w8do/windsurf_just_got_unusable_for_me_with_the_latest/mghz9ov/
