id,title,text,created_at,score,num_comments,upvote_ratio,subreddit,author,is_post,source,url
1j8dgk9,Unexpected Memory Side Wffects,"I'm working on 4+ projects at once with Windsurf. The model doesn't seem to distinguish between them. So he's applying memories from one project to drive changes in others.

Many times, what was a good memory for one, screws up the other.

I'm not sure what to do about it other than remind him when he starts to use an inapplicable memory, but that's a pita because I don't know until he does it.

Granted, it's probably exacerbated by the fact that 3 projects are quite similar and share some code. But they have different end goals.",2025-03-10 16:59:20,1,1,1.0,Codeium,nebulousx,True,Reddit (r/Codeium),https://www.reddit.com/r/Codeium/comments/1j8dgk9/unexpected_memory_side_wffects/
1j7uxxz,Codeum Compared to GitHub Copilot and Other AI Coding Assistants,"This article below compares GitHub Copilot to Codeium and other AI-powered coding assistant alternatives: [Top 7 GitHub Copilot Alternatives](https://www.codium.ai/blog/top-github-copilot-alternatives/)

It discusses why developers might seek alternatives, such as cost, specific features, privacy concerns, or compatibility issues and reviews seven top GitHub Copilot competitors: Qodo Gen, Tabnine, Replit Ghostwriter, Visual Studio IntelliCode, Sourcegraph Cody, Codeium, and Amazon Q Developer.",2025-03-10 02:44:16,0,1,0.5,Codeium,thumbsdrivesmecrazy,True,Reddit (r/Codeium),https://www.reddit.com/r/Codeium/comments/1j7uxxz/codeum_compared_to_github_copilot_and_other_ai/
mgzzxb8,,"It’s interesting that neither Windsurf nor Cursor were compared in this article. Based on the reviews of the different AI assistants, I’m not really sure what the primary differences are between them.",2025-03-10 03:16:43,2,0,0.0,Codeium,Equivalent_Pickle815,False,Reddit (r/Codeium),https://www.reddit.com/r/Codeium/comments/1j7uxxz/codeum_compared_to_github_copilot_and_other_ai/mgzzxb8/
1j6dxq1,Connecting to Docker Container,"I'm running my app inside a docker container, but didn't manage to find a way to connect the IDE to operate in it so that the AI can run tests by itself, iterate over the results, and fix the code or tests if necessary. Is this possible in Windsurf?",2025-03-08 01:53:34,1,1,1.0,Codeium,Itchy_Finish_2103,True,Reddit (r/Codeium),https://www.reddit.com/r/Codeium/comments/1j6dxq1/connecting_to_docker_container/
1j5jt5d,Remote Tunnel Support,"Hi Community! 

I was wondering if Windsurf supports Remote Tunnel, as in VSCode (https://code.visualstudio.com/docs/remote/tunnels). If it does, can you please explain how to set it up? If not, are there any plans to add support for this feature?   
  
Thank you very much!",2025-03-07 01:39:00,1,1,1.0,Codeium,zallas003,True,Reddit (r/Codeium),https://www.reddit.com/r/Codeium/comments/1j5jt5d/remote_tunnel_support/
1j9dtxe,previewing PDF doesn't not work,"https://preview.redd.it/yai8g7zoh7oe1.png?width=1586&format=png&auto=webp&s=1c00a435f730962c70edadc3ee1ee63f449b1bff

such as this. windsurf cannot preview any PDF files which actually have contents. ",2025-03-11 23:53:19,1,0,1.0,Codeium,yuzhibo535,True,Reddit (r/Codeium),https://www.reddit.com/r/Codeium/comments/1j9dtxe/previewing_pdf_doesnt_not_work/
1j7d1v5,I had no idea codeium had this github-like chart for completions on the website.,,2025-03-09 10:44:57,22,4,1.0,Codeium,mekmookbro,True,Reddit (r/Codeium),https://www.reddit.com/r/Codeium/comments/1j7d1v5/i_had_no_idea_codeium_had_this_githublike_chart/
1j9ksbo,Codeium for e-commerce project based on Wordpress + WooCommerce?,"Hey guys, I am currently creating an e-commerce project (e-shop) that I am building on Wordpress platform that uses WooCommerce. Will Codeium help me in my work and possibly anyone has any experience?",2025-03-12 07:02:32,1,0,1.0,Codeium,orangesonicangelo,True,Reddit (r/Codeium),https://www.reddit.com/r/Codeium/comments/1j9ksbo/codeium_for_ecommerce_project_based_on_wordpress/
mgxjtu7,,"You could also indicate how you use it, so maybe it's easier to tell you what you're doing well and what you could manage better. I have the Pro plan (1500 monthly credits for actions) and I get by on that month. using Windsurf full time but not premium models full time, obviously.
I try to optimize my requests in order to optimize the consumption of tools, everything I can do for free I do for free, taking more time but saving credits. if you always want to use only the very strong model the result is what you found, there are no ways out.. I would probably finish the credits in 5 hours :)
imagine you have $1500, how can you not finish them? man, you don't have to spend them, it's simple.
they should probably make a truly unlimited plan... but I don't know at what price... my pockets stop at Pro and they also struggle.",2025-03-09 15:59:19,3,0,0.0,Codeium,Agrume303,False,Reddit (r/Codeium),https://www.reddit.com/r/Codeium/comments/1j7jyg0/pro_ultimate_ran_out_of_flow_actions_in_5_days/mgxjtu7/
mgxlvtt,,"I use Claude 3.5/3.7 about 70% of the time. I have extremely detailed list of rules in .windsurfrules., which alsi include a list of common mistakes. I have a [dily-log.md](http://dily-log.md) which tracks absolutely any changes ( in a sence a changelog) , so that Clause doesnt run in circles and find the erorr if taht occurs again. DeepSeek r1 a lot of time is just thnkng, but either doenst execute, or doesnt call other tools. I am running on ""turbo"" autoaprove mode. I guess i wil be include to pay  some fixed amount as long as i can get the job done efficiently and fast. zSeperate from windsurf, i really like the Outcome as a an achiever result from Cline, but it is even more expensive than usinf Windsirf Premoum models. perhaps it will be always a balance between $$ VS Time spent on manual coding..",2025-03-09 16:10:49,5,0,0.0,Codeium,Interesting-Winter72,False,Reddit (r/Codeium),https://www.reddit.com/r/Codeium/comments/1j7jyg0/pro_ultimate_ran_out_of_flow_actions_in_5_days/mgxlvtt/
mh1fwhm,,"Correct, Claude's own agent implemention.

You'll get the raw - full context model but it's super expensive relative to codeium. 

Codeium pro is a great deal since they are probably costing them 20-50$.",2025-03-10 08:54:37,2,0,0.0,Codeium,Qiazias,False,Reddit (r/Codeium),https://www.reddit.com/r/Codeium/comments/1j7jyg0/pro_ultimate_ran_out_of_flow_actions_in_5_days/mh1fwhm/
mh2w2tm,,"Yeah 20 years just lazy asf since windsurf, i find myself asking it for studf i could literally do in 20 sec myself 🤣",2025-03-10 13:00:00,2,0,0.0,Codeium,SetAwkward7174,False,Reddit (r/Codeium),https://www.reddit.com/r/Codeium/comments/1j7jyg0/pro_ultimate_ran_out_of_flow_actions_in_5_days/mh2w2tm/
mglsdog,,"Was working great, unusable for over 24hrs for me and 6 other folks on my team. No answers from Codeium. Argh!",2025-03-07 16:27:20,4,0,0.0,Codeium,kosta123,False,Reddit (r/Codeium),https://www.reddit.com/r/Codeium/comments/1j5xycr/others_experiencing_behavior_like_this/mglsdog/
mgkbcul,,"[https://www.reddit.com/r/Codeium/comments/1j5ihvp/i\_havent\_been\_able\_to\_use\_windsurf\_at\_all\_this/](https://www.reddit.com/r/Codeium/comments/1j5ihvp/i_havent_been_able_to_use_windsurf_at_all_this/)

:(((((((((((",2025-03-07 11:39:35,2,0,0.0,Codeium,MrLoww1,False,Reddit (r/Codeium),https://www.reddit.com/r/Codeium/comments/1j5xycr/others_experiencing_behavior_like_this/mgkbcul/
mhftdul,,"I had a call with their community manager. Really, really nice guy.

It's my opinion that the mod logged on, got bombarded and stressed and reacted badly. I don't think they trained them on how to respond to a major incident (but clearly the status page should have immediately gone red, and the mods should have been apologetic not hostile).

So I definitely give Windsurf credit for their excellent community team, but obviously not the volunteer mod(s).",2025-03-12 12:37:12,8,0,0.0,Codeium,bluelightning2k,False,Reddit (r/Codeium),https://www.reddit.com/r/Codeium/comments/1j9o6ft/removing_users_posts_is_not_honest_behavior/mhftdul/
mhgi0tq,,I cancelled my subscription today. I used to love windsurf but it just got unusable.,2025-03-12 14:36:47,1,0,0.0,Codeium,flying-capibara,False,Reddit (r/Codeium),https://www.reddit.com/r/Codeium/comments/1j9o6ft/removing_users_posts_is_not_honest_behavior/mhgi0tq/
mhgm3aj,,"He is also the admin on an X Windsurf community: https://x.com/i/communities/1889976002400686208 

But the best is also to comment problems under windsurf or Codeium post on X",2025-03-12 14:56:36,2,0,0.0,Codeium,valentino99,False,Reddit (r/Codeium),https://www.reddit.com/r/Codeium/comments/1j9o6ft/removing_users_posts_is_not_honest_behavior/mhgm3aj/
mhfsjfu,,"Cursor has just as many problems and even with Cursor support there have been incidents like this, so you can change, for sure, but you would find a very similar situation. In other words, I don't think that's the solution and in both cases, the problem is a single individual, I mean... It's not that because one person messes up, it's the entire team's fault. The Codeium team itself upvoted this post, they could have just removed it if they wanted.",2025-03-12 12:33:09,3,0,0.0,Codeium,Agrume303,False,Reddit (r/Codeium),https://www.reddit.com/r/Codeium/comments/1j9o6ft/removing_users_posts_is_not_honest_behavior/mhfsjfu/
mhh2b8b,,"meanwhile, some people on Cursor’s sub have the same exact complaints and threaten to switch to Windsurf.",2025-03-12 16:19:20,2,0,0.0,Codeium,-pLx-,False,Reddit (r/Codeium),https://www.reddit.com/r/Codeium/comments/1j9o6ft/removing_users_posts_is_not_honest_behavior/mhh2b8b/
1j9lbc4,How To Check Services Status,"Good morning folks! 

When your experience network errors you can always check to see if there’s any issues reported on the website at this link:

https://status.codeium.com/

Sometimes the issue comes from upstream (Anthropic) but won’t be shown on our status page. Anthropic does have a status page as well, you can find that here:

https://status.anthropic.com/

Also please keep in mind that slight “hiccups” in the system sometimes happen but they are self resolved so quickly that the monitoring systems don’t even pick them up. 

Happy Surfing 🌊 🏄‍♂️ ",2025-03-12 07:26:08,5,13,0.78,Codeium,SouthbayJay_com,True,Reddit (r/Codeium),https://www.reddit.com/r/Codeium/comments/1j9lbc4/how_to_check_services_status/
mheqcqe,,"I am frustrated - specifically - with Codeium (you) - lashing out at the user (me) for flagging the major outage & sending root-cause analysis

I am frustrated with your absurd opinion that the status page should be green, and/or that a company like Codeium doesn't have the capability to post a message there",2025-03-12 09:31:39,2,0,0.0,Codeium,bluelightning2k,False,Reddit (r/Codeium),https://www.reddit.com/r/Codeium/comments/1j9lbc4/how_to_check_services_status/mheqcqe/
mhes0n9,,"You still think that a green status page represents the status of Windsurf? I am deeply curious what you think a status page is?

And it's not ""your frustration"" it's the specific actions of you - SouthbayJay - censoring the community here and elsewhere. You don't need to apologise for your product, but you absolutely should own your own behaviour.",2025-03-12 09:39:36,2,0,0.0,Codeium,bluelightning2k,False,Reddit (r/Codeium),https://www.reddit.com/r/Codeium/comments/1j9lbc4/how_to_check_services_status/mhes0n9/
mhfxhkb,,"Its not the extra steps being taken. Its Codeiums flawed credit system.

We are being charged excessively per flow to what theyre being charged from Anthropic. Check my post on this.",2025-03-12 12:56:37,4,0,0.0,Codeium,Dismal-Eye-2882,False,Reddit (r/Codeium),https://www.reddit.com/r/Codeium/comments/1j9nhk6/unnecessary_steps_wasting_credits/mhfxhkb/
mheudpk,,"Are you saying the same model (3.7) is now acting differently? Or you were using 3.5 before and now 3.7?

The 3.7 model has different tool calling tendencies than 3.5. Codeium is not changing the model to consume more credits on purpose, the model simply behaves more aggressively. The last few changes has actually decreased credit consumption due to community feedback.",2025-03-12 09:50:47,1,0,0.0,Codeium,Ordinary-Let-4851,False,Reddit (r/Codeium),https://www.reddit.com/r/Codeium/comments/1j9nhk6/unnecessary_steps_wasting_credits/mheudpk/
mhfxtt7,,It IS Claude 3.7 and it's not the problem. The problem is Codeiums credit system does not work with 3.7. We are being overcharged 10x now. Theyre trying to stop 3.7 from doing what 3.7 needs to do. Instead they need to charge on token usage.,2025-03-12 12:58:12,2,0,0.0,Codeium,Dismal-Eye-2882,False,Reddit (r/Codeium),https://www.reddit.com/r/Codeium/comments/1j9nhk6/unnecessary_steps_wasting_credits/mhfxtt7/
1j52gva,Failed to log in: ConnectError: [permission_denied] api server wire error: user is disabled by team,"https://github.com/Exafunction/codeium/issues/129
https://github.com/Exafunction/codeium/issues/128


Did anyone's issue regarding this get solved yet, this is extremely annoying.",2025-03-06 10:34:11,2,8,1.0,Codeium,ritavdas,True,Reddit (r/Codeium),https://www.reddit.com/r/Codeium/comments/1j52gva/failed_to_log_in_connecterror_permission_denied/
mguyo0r,,"I've also been experiencing consistent errors since Claude 3.7 Sonnet was released. The issue occurs not only with Claude 3.7 Sonnet but also with Claude 3.5 Sonnet. I'm subscribed to Cursor as well, but I haven't encountered the same issues on Cursor even when using Claude 3.7 Sonnet.

These persistent problems on Windsurf seem quite serious. It's disappointing to see no sign of improvement even after one or two weeks.

Additionally, there's a severe issue with excessive usage of Flow Action Credits when using Claude 3.7 Sonnet.

Windsurf is losing its competitiveness.",2025-03-09 07:56:21,4,0,0.0,Codeium,Individual-Storm8919,False,Reddit (r/Codeium),https://www.reddit.com/r/Codeium/comments/1j71ocp/error_while_creating_or_editing_file_in_writing/mguyo0r/
mgy0rlr,,[https://windsurf-stable.codeiumdata.com/win32-x64-user/stable/0f80b7c19f8b1378a97a1304da23b6b06e767db0/WindsurfUserSetup-x64-1.3.11.exe](https://windsurf-stable.codeiumdata.com/win32-x64-user/stable/0f80b7c19f8b1378a97a1304da23b6b06e767db0/WindsurfUserSetup-x64-1.3.11.exe),2025-03-09 17:36:12,1,0,0.0,Codeium,Administraciones,False,Reddit (r/Codeium),https://www.reddit.com/r/Codeium/comments/1j6p944/how_to_downgrade/mgy0rlr/
mgtz1q4,,"I can't help you much because you're working with things I don't know much about, but I understand how Windsurf works quite well, so I can help you on a couple of points: the .md documents are more useful to you than to Cascade. In the sense that you should make it read the documents every time, in every conversation, and if you do it with a premium model you will only consume credits for this. So, here's my example: I have my workspace ""Modulandia"", inside the workspace I have 3 folders: Modulandia, Context, Appunti.
Modulandia is the project folder, it contains the code, the build folder... Context is the folder with the .md files that I prepare for Cascade. Appunti is a folder with .txt files that are exclusively useful to me (for example, a list of commands for the terminal).


How I recommend you use the .md files:
write them, make Cascade Base read them only once and ask it to create a memory. This way you don't have to make him read them later (unless you need to update them... for example if you have Changelog.md and the corresponding saved memory Changelog, update your .md file, delete the saved memory, tell him to read the .md file and create a memory with that information. You can also ask him to just update the memory, but it doesn't always work well and sometimes duplicate memories, so I always prefer to delete the memory and recreate it updated, so having the .md files is useful for you to keep control over the situation, once you have saved Cascade's memories, the .md files become useless for him).


How to mention files for context: mention specific files, for example @Main.cpp, @MainWindow.cpp etc... mentioning the folder doesn't help much, all Cascade will do is look at what files are inside the mentioned folder, then it will have to read those files... So if you mention the files directly, you save time and he saves effort.


Mentioning the folder can be useful when you don't even know where to look for something, situations like: function X should be in one of the files in the @Core folder. then Cascade will look at the files in the folder, try to figure out which file is most likely to contain that functionality, and search until it finds it. but you can do the same thing without mentioning folders and Cascade will simply search the entire workspace.",2025-03-09 03:20:29,3,0,0.0,Codeium,Agrume303,False,Reddit (r/Codeium),https://www.reddit.com/r/Codeium/comments/1j71p0a/how_to_properly_feed_multiple_api_docs_to_cascade/mgtz1q4/
mguy38g,,"Wow thank you for such a detailed response! So many useful things

>the .md documents are more useful to you than to Cascade

What do you mean? I've heard that a well-formatted structured markdown is the best format in which to convey a lot of information in an LLM context. There are two alternatives to do this in Windsurf: 1) ask this person via @ web to follow a link and read the api documentation web page, but this doesn't work well, I've tested it many times OR 2) drop chunks of documentation as is directly into the prompt, but this doesn't sound or look right.

>write them, make Cascade Base read them only once and ask it to create a memory

I don't write them myself, I parse them. That's a dozen different API providers and a bunch of method descriptions and code snippets. How can this fit in Cascade Memory?",2025-03-09 07:53:02,1,0,0.0,Codeium,stepahin,False,Reddit (r/Codeium),https://www.reddit.com/r/Codeium/comments/1j71p0a/how_to_properly_feed_multiple_api_docs_to_cascade/mguy38g/
1j9lqbq,"V3 model is a chameleon, but an inferior one","Not sure if any of you notice it but whenever I used a model and then switched to V3, V3 will act just like the previous model I used.

For example, if I used R1, then switched to V3, it will also have the thinking process. If I used Sonnet 3.5  or 3.7 then switched to V3. Then it will also keep analyzing files and even take ""find"" action which I rarely see with V3. 

But after a few convos it will act strangely such as repeating the same sentence again and again without making any edit. 

I guess it's a bug that Codeium team will take seriously if it in fact calls Claude API instead of using the in-house V3 model when we are using a V3 model.",2025-03-12 07:49:21,1,2,1.0,Codeium,Personal-Expression3,True,Reddit (r/Codeium),https://www.reddit.com/r/Codeium/comments/1j9lqbq/v3_model_is_a_chameleon_but_an_inferior_one/
mh20uwv,,"- The file list update doesn't always work properly, I often find the same file duplicated when I have to mention a file in chat, maybe just because I renamed ""main"" to ""Main"" and I see both...
Sometimes just restart Windsurf and I get only the current files...sometimes a full reset is needed (delete the .codeium folder from Appdata, before doing that make sure you have a backup of the rules you set, because you will have to set them again, you will also have to set the Autocomplete and Terminal mode settings again, if you changed them, and of course all the memories you are still interested in, will have to be created again).


- If you don't specify the model you are using, it's hard to tell. Even though the base of Cascade is the engine of all models, each model will affect the behavior of Cascade differently. I guess it's 3.7, I often see the behavior you describe with 3.7. Often it thinks about the code, makes changes, then realizes it could have made them better, then changes again, then realizes it needs to look at more files to better understand the context, then realizes it needs to make more changes... By the time it's done, it's probably eaten 50 credits.


But 90% of the time you'll get the desired result without any compilation errors (or with a couple of small errors that will be fixed immediately).


Sometimes it obviously goes crazy and does things wrong, but of all the models it seems to me to be the most accurate in finding solutions, leaving aside the fact that it eats up your entire subscription plan to do so.",2025-03-10 10:32:29,1,0,0.0,Codeium,Agrume303,False,Reddit (r/Codeium),https://www.reddit.com/r/Codeium/comments/1j83jzy/questions_about_cascade/mh20uwv/
mgj5vb2,,Can you send me your account email? You should be able to continue working. Additionally please submit a support ticket at www.codeium.com/support in the meantime!,2025-03-07 08:22:23,2,0,0.0,Codeium,Ordinary-Let-4851,False,Reddit (r/Codeium),https://www.reddit.com/r/Codeium/comments/1j5qge2/ive_just_purchased_flex_credits_but_nothing/mgj5vb2/
1ja6b34,Which AI coding extension do you use ?,"There are so many AI coding extensions like Copilot, Blackbox AI, Tabnine, Codeium, and more. So which one do you actually use and why? ",2025-03-13 00:10:15,0,17,0.44,vscode,Eugene_33,True,Reddit (r/vscode),https://www.reddit.com/r/vscode/comments/1ja6b34/which_ai_coding_extension_do_you_use/
1j7c8sk,AI Extensions for Emacs,"I've been motivated by projects like cursor and windsurf to build extensions for emacs.  
  
I pushed two extensions for emacs last night and would love the feedback of this community.  There are two extensions included

1.  AI code completion.  The extension works by allowing users to highlight the relevant code, trigger a keybinding, and the completed code is then displayed beneath the highlighted area.  
2.  AI QA.  Within the editor, you can trigger indexing of your local repo in Chroma DB with a keybinding.  This allows QA to not only make use of ChatGPT, but also provides relevant context from your repo.

Here is the github repo:

[https://github.com/demajh/emacs\_ai\_extensions](https://github.com/demajh/emacs_ai_extensions)",2025-03-09 10:09:28,12,9,0.63,emacs,demajh,True,Reddit (r/emacs),https://www.reddit.com/r/emacs/comments/1j7c8sk/ai_extensions_for_emacs/
1ja2658,IS Windsurf fre good enough for a real project?,Will the free version stop or downgrade in the middle?,2025-03-12 19:47:23,3,2,1.0,ChatGPTCoding,Silvercats2,True,Reddit (r/ChatGPTCoding),https://www.reddit.com/r/ChatGPTCoding/comments/1ja2658/is_windsurf_fre_good_enough_for_a_real_project/
mhibmc7,,Just use Cursor. I used windsurf for 2 months and subbed to their $60 plan. But they are unreliable and support is garbage. Cursor is just superior.,2025-03-12 20:36:25,2,0,0.0,ChatGPTCoding,NickoBicko,False,Reddit (r/ChatGPTCoding),https://www.reddit.com/r/ChatGPTCoding/comments/1ja2658/is_windsurf_fre_good_enough_for_a_real_project/mhibmc7/
1ja6n22,GitHub Copilot in VS Code insiders is very slow compared to cursor and windsurf.  Why ?,I’m struggling with slow running copilot which takes for ever and ever.  ,2025-03-13 00:36:15,3,2,1.0,ChatGPTCoding,appakaradi,True,Reddit (r/ChatGPTCoding),https://www.reddit.com/r/ChatGPTCoding/comments/1ja6n22/github_copilot_in_vs_code_insiders_is_very_slow/
1j4t2xj,Anyone else using Windsurf having issues?,"Hi I want to keep this brief.  Using Windsurf lately has been kind of difficult.  There are either loop errors or unresponsive AI.  Doesn't happen immediately, but after about 30 mins these errors become prominent.  I don't have any screen shots I am sorry.  Has anyone noticed anything similar?",2025-03-06 03:06:40,2,2,0.75,ChatGPTCoding,jomiscli,True,Reddit (r/ChatGPTCoding),https://www.reddit.com/r/ChatGPTCoding/comments/1j4t2xj/anyone_else_using_windsurf_having_issues/
mgcbkwi,,I tried WindSurf last night for the first time and I was not impressed. The editor is clunky and responses are not fast or accessible. Overal I give it a 4 if Cursor is 9.,2025-03-06 07:24:47,1,0,0.0,ChatGPTCoding,blnkslt,False,Reddit (r/ChatGPTCoding),https://www.reddit.com/r/ChatGPTCoding/comments/1j4t2xj/anyone_else_using_windsurf_having_issues/mgcbkwi/
1j8rctp,Build An Astro Blog From Scratch with WindSurf,"I have my blog for some time in astro and with tailwindcss v4 wanted to do a refresh so wanted to give windsurf a try. in 2-3 days I build the blog from scratch with windsurf, it's the best tool that AI used so far for coding and use it for specific things and I tried a few, basically all that exists I have created an article with a video with some details here: [https://www.bitdoze.com/windsurd-build-astro-blog/](https://www.bitdoze.com/windsurd-build-astro-blog/)",2025-03-11 06:57:20,3,0,1.0,ChatGPTCoding,bitdoze,True,Reddit (r/ChatGPTCoding),https://www.reddit.com/r/ChatGPTCoding/comments/1j8rctp/build_an_astro_blog_from_scratch_with_windsurf/
