id,title,text,created_at,score,num_comments,upvote_ratio,subreddit,author,is_post,source,url
mgp59w4,,"I have the annual Pro plan. It lasts about half a month before eating all my credits. A lot of credits are wasted in needless extra tasks it decides to run, bug fix error loops it won’t catch itself doing and rabbit holes. I have spent $500 in a month keeping a project moving forward using multiple IDEs. Mostly now I’m bouncing between windsurf at the beginning of the month then, when my credits are gone I go to Roo Code and Co-Pilot. Paid for co-pilot annual plan and it has Claud 3.7 without burning credits but none of the great editing features that Windsurf or Roo Code has. I would love it if my WS plan could last out an entire month  Just fyi from practical experience.",2025-03-08 07:48:00,5,0,0.0,Codeium,AdmrilSpock,False,Reddit (r/Codeium),https://www.reddit.com/r/Codeium/comments/1j64w5x/so_i_paid_the_pro_plan/mgp59w4/
mgpoywz,,"Wow.. I have copilot also so I'm gonna move windsurf and copilot... hoping copilot get close to cascade :( , what's Roo Code? Is it good?",2025-03-08 09:28:53,1,0,0.0,Codeium,slasho2k5,False,Reddit (r/Codeium),https://www.reddit.com/r/Codeium/comments/1j64w5x/so_i_paid_the_pro_plan/mgpoywz/
1j5zdpw,Compliment when compliment is due ❤,"There's a lot of critic towards Windsurf, I myself wrote a post complaining about a barrage of errors and instability and constant hallucinations from cascade.  
  
But I really think it'd be unfair to not write a post complimenting all the improvements the team has delivered recently!  
  
Before claude 3.7 I had to choose between 3.5 which was stupid and didn't give any good solutions, or try my luck with R1 or O3 and going mad because it'd propose good solutions but refused to apply the changes even if I was on write mode and explicitly told it to write the changes to the file like ""PLEASE APPLY THE CHANGES YOU PROPOSED"".  
And not to mention the constant errors and instabilities. It really wasn't good and I almost gave up on Windsurf.

With Wave 3 and 4 and Claude 3.7 things changed DRASTICALLY, I can honestly say that I'm pretty happy using Windsurf. 3.7 almost always proposed good/sane solutions and cascade almost always applies everything flawlessly. The pre-configured MCP servers have been super useful, and I just solved a problem using the Preview feature: I selected an element that was looking wrong and another that was looking correctly, asked cascade ""why?"" and it figured out the problem and fixed it.

So just want to say THANKS! To the Windsurf team! You've been doing an amazing job!

PS: Token consumption has been great! I'm 1/3 through my subscription period (\~10 days), and I have \~60% of my tokens available, so it more or less lasts me a month. Im a senior developer so I don't use AI for everything, I only use 3.7 Thinking model that consumes 1.25 tokens, so for actual developers the amount of tokens right now is perfect!

The only feedback I have is that I still get a lot of ""Cascade error"", sometimes like 5 - 10 in a row. Not a deal breaker as everything else is working great! But if the team code fix these cascade errors I think its the missing thing to make Windsurf perfect IMO!",2025-03-07 12:26:22,25,6,0.97,Codeium,No-Significance-279,True,Reddit (r/Codeium),https://www.reddit.com/r/Codeium/comments/1j5zdpw/compliment_when_compliment_is_due/
mgoknm3,,"I’m on the $15 plan (I actually pay $10 because I was an early adopter, so great deal!)

I really think that if you’re a professional dev, the $15 plan is more than enough. I use 3.7 thinking for everything and it’s lasting me a month, but if you use LLM a lot you can use strategies like using the base model (which is unlimited and doesn’t consume tokens) for more mundane tasks and 3.7 for complex ones.

PERSONAL opinion: I think at this point Windsurf is better than Cursor. The only people for which cursor might be better are people that don’t know how to code and use LLM for everything, the unlimited slow premium model they have on Cursor becomes interesting on this situation. But DX wise, I think Windsurf is better and also in terms of development pace, windsurf is evolving WAY faster.",2025-03-08 05:48:40,4,0,0.0,Codeium,No-Significance-279,False,Reddit (r/Codeium),https://www.reddit.com/r/Codeium/comments/1j5zdpw/compliment_when_compliment_is_due/mgoknm3/
mgqy19z,,"yeah, i agree windsurf is  better than cursor, i also a senior developer

however somehow i became lazier, most of my time is to ask ws to code and review it in case out of control, for this kind of workflow the back/revert button is so useful, even it is not perfect, but it is ok because i git commit often",2025-03-08 13:25:32,1,0,0.0,Codeium,dodyrw,False,Reddit (r/Codeium),https://www.reddit.com/r/Codeium/comments/1j5zdpw/compliment_when_compliment_is_due/mgqy19z/
1j4knct,Cascade Base is usable now??,"Okay, I don't know what you guys did (no mention of Cascade Base changes from changelogs IIRC), but it is no longer duplicating actions for me, so far. It kept duplicating tool calls in the past, but now it doesn't?!

Now granted, the premium Claude models are better if I'm in my lazy potato phase of the week. But when I want work done in the human-agent step-by-step manner, Cascade Base has been completely usable the whole day for me!

(And Windsurf Previews is prettyyyy cool if I do say so myself!)

That's it, just wanted to say that. Now I have a usable model when I want work done in a granular way without wasting credits (granted I still have \~350 prompt credits and \~800 action credits and I'm a week away from credits renewing :b better make use of that).",2025-03-05 18:05:11,10,8,0.92,Codeium,Artiano,True,Reddit (r/Codeium),https://www.reddit.com/r/Codeium/comments/1j4knct/cascade_base_is_usable_now/
1j5tiqo,Need a .windsurfrules template? Check out the new directory!,"How to write good rules?

The best rules are specific to the user and tell Cascade things that it would otherwise not know about the user and the codebase.
The following rules are curated by the Windsurf team and are examples of rules that can guide Cascade to better understand the user and their codebase, resulting in higher quality responses.",2025-03-07 08:59:41,24,6,0.96,Codeium,Ordinary-Let-4851,True,Reddit (r/Codeium),https://www.reddit.com/r/Codeium/comments/1j5tiqo/need_a_windsurfrules_template_check_out_the_new/
mgkeenw,,"Great to see! Can the team add any additional guidance around current best practices for Windsurf rules? I would love to better understand:

\- Where should we place general rules (that apply to all projects)? If it is a file, what do we name the file?

\- Where do I place project-specific rules? What do we name the file?

\- Can we have various different project-specific rules? i.e. : Next.js rules, TypeScript rules, etc.

\- What is the 'sweet-spot' in terms of writing rules? Is less sometimes more? Or are long and verbose rules the best approach?

\- Will windsurf pickup on these rules context automatically, or do we always need to specifically add the rules files to the context in Cascade?

Thanks in advance!",2025-03-07 11:54:26,3,0,0.0,Codeium,Cheap-Eye-6091,False,Reddit (r/Codeium),https://www.reddit.com/r/Codeium/comments/1j5tiqo/need_a_windsurfrules_template_check_out_the_new/mgkeenw/
mgu6kya,,"How do rules impact the size of the system prompt? 

If I have 6000 lines in my global rules plus windsurfrules, then surely that is going to be slow, blow out the context window and/or leave not much space for a decent response from the selected LLM.",2025-03-09 04:36:34,1,0,0.0,Codeium,joey2scoops,False,Reddit (r/Codeium),https://www.reddit.com/r/Codeium/comments/1j5tiqo/need_a_windsurfrules_template_check_out_the_new/mgu6kya/
1j6etly,Is it better to use deepseek v3 when there's no image for a everyday use when I am pro plan,Hi guys! I have a question and suggestion is it better to use the deepseek v3 since it has a unlimited chats and flow right? So it's better to use it and also if I want to use an image I would use the sonnet models is this great for maintaining it to balance the credits for $15 right? Is this a great idea for workflow or using the windsurf?,2025-03-08 02:59:59,4,5,0.83,Codeium,T1nker1220,True,Reddit (r/Codeium),https://www.reddit.com/r/Codeium/comments/1j6etly/is_it_better_to_use_deepseek_v3_when_theres_no/
1j544gk,Has Anyone Created a SaaS?,"You don't have to say what it is (unless you want to), but I'm curious about whether anyone has used Windsurf to:
1. Create a profitable SaaS.
2. Was able to market it successfully.

I'm in the process of creating one, but I have no idea about how to market it, once I finish the initial development.

I'd like to kinda crowd-source you all for marketing ideas 😄 if you're willing to share, of course.",2025-03-06 11:42:37,0,5,0.5,Codeium,BC_Future,True,Reddit (r/Codeium),https://www.reddit.com/r/Codeium/comments/1j544gk/has_anyone_created_a_saas/
1j8pivq,Sonnet 3.7 really impressed me for starting a project from scratch,"I shared my experience how I got frustrated from using sonnet 3.7 in my existing project. It costs lots of flow credits but didn't deliver ideal result. But given it is so relentlessly reviewed multiple files back and forth, I got the hope that it can do better at a blank project. So after developing the backend, I gave it a try with my flutter project. 

I tried to make the requirement as details as possible (though not as that detailed as when I was in the corp needing to pass the PRD to engineering team), and then I asked R1 to review the requirements and make a plan based on the requirement. Then I revised the plan a few times trying to reduce ambiguity.  I wasn't that greedy to make everything in the plan because I don't want to overload Sonnet and its buddies so I just got the onboarding module + shared components + core services + data models detailed in the requirement and plan. 

Then Sonnet 3.7 starts its working. It lasted about 30 mins, and more than 50 files were created. I saw it creating the files and then went through files to fix lint errors all over again, speaking of which I really appreciate Windsurf doesn't cost credits when fixing lint errors.

I started the simulator nervously but it successfully started and gave a workable app as I expected. There are still some small issues that I may need to fix later, but so far I was just amazed by what Sonnet 3.7 and Windsurf could do!

Thank you Codium team!",2025-03-11 05:26:24,23,2,0.97,Codeium,Personal-Expression3,True,Reddit (r/Codeium),https://www.reddit.com/r/Codeium/comments/1j8pivq/sonnet_37_really_impressed_me_for_starting_a/
1j8iiwn,"Why is it possible to write complex code, but not follow explicit orders in memories?","Please somebody explain why even in 3.7 thinking that Windsurf can create complex code, yet can't be bothered to follow explicit instructions in memories and verified-code files so it stops making the same (really dumb) mistakes, wasting time and credit?

",2025-03-10 21:17:44,2,4,1.0,Codeium,fogyreddit,True,Reddit (r/Codeium),https://www.reddit.com/r/Codeium/comments/1j8iiwn/why_is_it_possible_to_write_complex_code_but_not/
1j7vhb8,Cascade is missing,"Hi everyone,

I’m having trouble seeing a cascade in my windsurfing app. I’m not sure why this is happening. I’ve tried uninstalling and reinstalling the app, but the issue persists.

Has anyone else experienced this problem?

Thanks!",2025-03-10 03:23:40,1,4,1.0,Codeium,Shazeb02,True,Reddit (r/Codeium),https://www.reddit.com/r/Codeium/comments/1j7vhb8/cascade_is_missing/
1j4lztg,"A few ideas for additional ""modes"" that I think could be amazing","I have a few ideas for mode prompts that I think could be really useful and I figured that rather than keeping them locked up in my head or launching a crazy ""Windsurf killer"" (I kid), I'd share them here lest they stimulate any interest.

The ""classic"" modes that everyone seems to be replicating at the moment are (IMO): code, chat (although nobody seems quite sure what the point is) and ""architect"" (or plan).

I suggest that there's huge latent potential in all of the following use-cases for agentic IDEs:

**Documentation Mode**

My idea for a documentation mode is one in which the agent/Cascade is primed to focus primarily not on code generation but on documenting the code base. Think about smaller repositories where the docs don't live in a separate repo yet. Or even something I've begun doing, which is creating my own reference doc folder in the repository where I get the agent to explain what it's done so that I can try to keep up with its changes. 

**UI/UX Mode**

My idea for this one is a mode where the agent is instructed to focus primarily on UI, UX, CSS. My thinking for this idea is that it would be great to offload some of the effort in prompting very specifically for work on certain parts of the repository. If the agent could know that this is a design session, it could be more targeted. 

**Backend/Frontend Etc**

Another idea for a mode to intentionally ring-fence the agent just a little. So you're working on an integrated codebase with frontend and backend together and you don't want the agent to start mopping up contacts from the wrong parts of the repo too easily and eagerly ... set a mode to guide its focus on one aspect.

**Debugging Mode**

Focused on proactively finding and remediating bugs.

**Security Mode**

Focused on proactively evaluating the security of the codebase, evaluating adherence to best practices based on the language, etc. An audit style functionality basically.

**Dev Ops Mode**

Focused on preparing deployment scripts and strategising deployment.

**Collaborative Mode**

Focused on helping users learn how to collaborate on coding projects, esp open source projects. Guides user towards the contribution guidelines in the repository. Guides on best practices in preparing clean branches and generating properly formatted pull requests.

**YOLO Mode**

Agent is preconfigured with a very high temperature and system-prompted to unleash their creativity on your codebase. Implement radical UI changes. Come up with and implement random feature additions. Don't ask the user. Could be perilous .. or fun.

**Education / Teaching Mode**

A mode where the primary objective of the agent isn't code generation and editing, but rather explaining code to you. This could be really interesting if you were able to provide an open-ended prompt asking something like, explain the overall structure of this. Or be a little bit more directive and point it to a specific part of the code base. I love learning programming by doing, so being able to have the agent pull in real examples could be a very powerful way of teaching,  IMO",2025-03-05 19:12:50,7,2,1.0,Codeium,danielrosehill,True,Reddit (r/Codeium),https://www.reddit.com/r/Codeium/comments/1j4lztg/a_few_ideas_for_additional_modes_that_i_think/
1j5nsmd,struggle and highlights with the last Update !,"I don’t have much coding experience beyond HTML/CSS, but I do have a good understanding of how things work conceptually. Over the past few days, I managed to put together some key components of an app idea I’ve been working on. Sonnet 3.7 is incredible—when it works.

https://reddit.com/link/1j5nsmd/video/nxoxhmjns9ne1/player

Yesterday, *after* the update, my experience was amazing (though the hours leading up to it were frustrating—spent a lot of credits with little to show for it. A partial refund would be nice since I burned through 2.8k credits in just five days).

Post-update, in just two prompts, I was able to create a plugin upload system with support for ZIP files, custom schema, deletion, and versioning. A few extra prompts helped iron out minor issues and styling. It all came together seamlessly! I ended up generating around eight different files to handle plugin registration, unzipping, and management.  See Video Below.

But today, it's back to being a nightmare—just look at the Layout Editor. I can't save the layout and item positions for each individual viewport size, and I’m also unable to add the ability to delete individual elements! - a pretty simple task, considering what Windsurf was able to do yesterday.

This kind of inconsistency from one day to the next is a serious problem. If AI tools like Claude Sonnet, Codeium, and others don’t address this, AI-assisted coding will remain a frustrating gamble rather than a reliable tool. 😕

https://reddit.com/link/1j5nsmd/video/3a4s2tkps9ne1/player

Also Adding the ability to Save the Layout using the same plugin engine windsurfe build was done in just like 2-3 prompts, adding a screenshot from the layout as preview, saving it to the plugin location, verfiying structure and schema, adding ability to change to custom thumbnail...",2025-03-07 05:32:20,3,3,1.0,Codeium,Illustrious-One-6755,True,Reddit (r/Codeium),https://www.reddit.com/r/Codeium/comments/1j5nsmd/struggle_and_highlights_with_the_last_update/
mgkw7m2,,"I understand your frustration when it seems like performance declines one day to the next.

It sounds like you had an amazing experience after the update, creating a sophisticated plugin system with minimal prompts. Then, the challenges you're facing today with seemingly simpler tasks can be understandably frustrating. However one thing to keep in mind, is that as your application grows in complexity, making changes can naturally introduce new challenges.

Some factors that might help improve consistency:

* **Provide detailed context in your prompts** \- Being specific about what you're trying to accomplish and how it should integrate with your existing code
* **Break down tasks into smaller steps** \- This helps the AI focus on one aspect at a time
* **Include relevant code snippets** \- Showing the AI the specific parts of your project that need to be modified

The inconsistency you're experiencing isn't necessarily a sign that the AI is getting worse, but could reflect how the complexity of your project has evolved, requiring more precise communication with the AI.

AI tools will continue to improve, and we are doing our best to make Windsurf the forefront of this technology. Feel free to message me if you have any questions",2025-03-07 13:31:53,1,0,0.0,Codeium,Ordinary-Let-4851,False,Reddit (r/Codeium),https://www.reddit.com/r/Codeium/comments/1j5nsmd/struggle_and_highlights_with_the_last_update/mgkw7m2/
mgkzhm9,,"Please don’t try to deflect responsibility or shift the blame onto the user—that doesn’t help anyone. The numerous similar comments from the community make it clear that this cannot simply be a skill gap.

Of course, users have tried breaking down their prompts into more detailed steps and have experimented with other AI models. However, as of today, there are cases where not a single prompt yields any result at all.

My intention with this post was never to ""bash"" Windsurf, but rather to highlight how great it *can* be. *However*, on days like today, yesterday, and all the other times users have reported issues, there needs to be a transparent statement—whether on Twitter, within the app, or elsewhere—informing the community that something is broken. That way, we can simply postpone our tasks instead of wasting time and growing frustrated.

Windsurf is undoubtedly a great tool, but the AI market is booming, with new tools emerging daily, and switching to alternatives has never been easier. Without transparency, acknowledgment of issues, and clear communication that the problem is known and being worked on, it will be difficult to build a strong and lasting community in the long run.",2025-03-07 13:48:35,1,0,0.0,Codeium,Illustrious-One-6755,False,Reddit (r/Codeium),https://www.reddit.com/r/Codeium/comments/1j5nsmd/struggle_and_highlights_with_the_last_update/mgkzhm9/
mgl7rmy,,"We're committed to improving consistency, but we're also trying to empower users with techniques that optimize results. The suggestions about detailed prompts and breaking down tasks aren't about shifting blame - they're proven strategies for working effectively with AI. 

There's a status check page here: [https://status.codeium.com](https://status.codeium.com) that you can check to see if there's any system wide issues. For everything else I urge users to use our support portal at [www.codeium.com/support](http://www.codeium.com/support) and submit a ticket for immediate customized support. 

I really appreciate your feedback and invite you to message me if you need anything!",2025-03-07 14:31:24,1,0,0.0,Codeium,Ordinary-Let-4851,False,Reddit (r/Codeium),https://www.reddit.com/r/Codeium/comments/1j5nsmd/struggle_and_highlights_with_the_last_update/mgl7rmy/
1j5xec2,Non Coder Help,Been using windsurf pretty heavily for the past couple or months. When I first started using this I used to see the chat running terminal commands in the chat. I’m not sure what I did but the chat cannot run terminal commands at all. I’ve tried a few setting but whenever it wants to run a terminal command I’ve been having to copy and manually run it in the terminal and then pasted the results. Any idea how to get this fixed? ,2025-03-07 11:16:41,2,2,1.0,Codeium,Atxguy1982,True,Reddit (r/Codeium),https://www.reddit.com/r/Codeium/comments/1j5xec2/non_coder_help/
mh7msg2,,"Hello,  I am experiencing issues with my SSO with Google.  It won't let me log in.  It says Unknown Fetch.  I can not use Windsurf or log in on the website.  I tried using Github, but it says that I already exist as a user using a different login method.  Can someone help?",2025-03-11 07:52:36,1,0,0.0,Codeium,No-Implement9292,False,Reddit (r/Codeium),https://www.reddit.com/r/Codeium/comments/1j8qand/log_in_with_github_added/mh7msg2/
1ja4r24,Failed to log in: ConnectError: [permission_denied] api server wire error: user is disabled by team.,"Hello, has anyone encountered this issue today? Earlier, I noticed that Autocomplete was not functioning, and then I saw a notification on the WindSurf website indicating that the WindSurf status was ""Degraded performance,"" which suggests that the server might have been down during that period. Now, I’ve discovered that my account is experiencing abnormalities. Could you please advise on how I should resolve this? Thank you!

https://preview.redd.it/4wx69pun5eoe1.png?width=910&format=png&auto=webp&s=d20c079bc98737ee4057a20eda3a1c6347b77b75

",2025-03-12 22:17:28,1,1,1.0,Codeium,ssiswent,True,Reddit (r/Codeium),https://www.reddit.com/r/Codeium/comments/1ja4r24/failed_to_log_in_connecterror_permission_denied/
1j9yj4u,a little help,"Hey, I'm looking for some help. I've been using Windsurf for a few months, but over the past week, I've been encountering this error: ""Let me update the store to ensure consistent snake\_case naming and fix TypeScript errors."" I have been working on the same project since January, so I'm not sure why this has suddenly become an issue.

Any advice would be appreciated!",2025-03-12 16:49:19,1,1,1.0,Codeium,Timely-Guidance6014,True,Reddit (r/Codeium),https://www.reddit.com/r/Codeium/comments/1j9yj4u/a_little_help/
mhhi7q6,,Does Cascade fix those lint / typescript errors? The latest Windsurf release has ability for Cascade to fix lint errors: [https://docs.codeium.com/windsurf/cascade#linter-integration](https://docs.codeium.com/windsurf/cascade#linter-integration),2025-03-12 17:44:29,1,0,0.0,Codeium,Silent-Grade-7786,False,Reddit (r/Codeium),https://www.reddit.com/r/Codeium/comments/1j9yj4u/a_little_help/mhhi7q6/
1j8xvzq,Logging in is broken on non-debian linux systems,"I have been trying diligently to figure this out and am pulling my hair out now. I have put in a request for a real solution to my problem (storing auth with profiles), but until then, I am ok with switching windsurf users by re-logging-in to the web and then re-logging-in in the windsurf. However, this process takes  twice as long as it should because there isn't a handler for the `windsurf://` urls the editor tries to use to redirect back to the IDE.

I use Fedora, which windsurf doesn't have a sys package for, so I have to use the tarball. The tarball doesn't have a .desktop file so I had to create my own. I finally managed to get something working so the login now opens windsurf, but it opens a new window, not the window that initiated the login request. When i try to open an existing project or a new window, the auth is lost. 

Here is my .desktop file:

```desktop
[Desktop Entry]
Name=Windsurf IDE
Comment=Harness Magick
GenericName=Text Editor
Exec=/home/sam/bin/windsurf %U
URL=windsurf:
Icon=Windsurf
Type=Application
StartupNotify=false
StartupWMClass=windsurf
Categories=TextEditor;Development;IDE;
MimeType=application/x-windsurf-workspace;application/x-windsurf;x-scheme-handler/windsurf;
Actions=new-empty-window;
Keywords=windsurf;ai;code editor;

[Desktop Action new-empty-window]
Name=New Empty Window
Name[de]=Neues leeres Fenster
Name[es]=Nueva ventana vacía
Name[fr]=Nouvelle fenêtre vide
Name[it]=Nuova finestra vuota
Name[ja]=新しい空のウィンドウ
Name[ko]=새 빈 창
Name[ru]=Новое пустое окно
Name[zh_CN]=新建空窗口
Name[zh_TW]=開新空視窗
Exec=/home/sam/bin/windsurf --new-window %F
Icon=Windsurf
```

Any help would be appreciated. Thank you!",2025-03-11 11:32:02,1,1,1.0,Codeium,skamansam,True,Reddit (r/Codeium),https://www.reddit.com/r/Codeium/comments/1j8xvzq/logging_in_is_broken_on_nondebian_linux_systems/
mh96g0b,,"Have you submitted a support ticket? (www.codeium.com/support) That might be best way to get the info you're looking for. 

I'll check with some devs in the meantime!",2025-03-11 12:16:14,1,0,0.0,Codeium,Ordinary-Let-4851,False,Reddit (r/Codeium),https://www.reddit.com/r/Codeium/comments/1j8xvzq/logging_in_is_broken_on_nondebian_linux_systems/mh96g0b/
