id,title,text,created_at,score,num_comments,upvote_ratio,subreddit,author,is_post,source,url
mgkt6gt,,"For anyone reading this Im understanding it a bit better now. You still have to run the local host you are just viewing it in the windsurf editor. This is super cool and saves having to jump between two screens. Yesss, now I can watch my youtube videos un-interrupted while working.",2025-03-07 13:13:46,1,0,0.0,Codeium,User1234Person,False,Reddit (r/Codeium),https://www.reddit.com/r/Codeium/comments/1j5h78b/windsurf_previews_the_ultimate_web_dev_tool/mgkt6gt/
1j8t0y2,Extreme frustration with windsurf flow,"I am a senior dev.

Today was my 2nd try to use the flow feature where you allow windsurf to write code and change directory etc. It was a brutally frustrating experiance. Worked great till the first 5 simple commands. Moment i started making specific styling requirements it made overhauling changes to global css, ruining the whole app. 

When i tried to make it rollback, it hallucinated for hours and kept runing it further. Finally, had to abandon the project. 

I use claude 3.7 sonnet. It was a day fully wasted. So i will go back to using the windsurf chat and not playing with write again for the time being. I guess, problems like these give ai a backseat when it comes to serious developments on critical projects. ",2025-03-11 08:11:57,8,13,0.83,Codeium,Own-Parsnip9687,True,Reddit (r/Codeium),https://www.reddit.com/r/Codeium/comments/1j8t0y2/extreme_frustration_with_windsurf_flow/
mhcij35,,I’d expect a senior dev relying on git and not in windsurf rollback.,2025-03-12 00:05:29,5,0,0.0,Codeium,jumpixel,False,Reddit (r/Codeium),https://www.reddit.com/r/Codeium/comments/1j8t0y2/extreme_frustration_with_windsurf_flow/mhcij35/
mhbrtb0,,Cursor’s new implementation of 3.7 has been frustrating and I decided to give WindSurfer yet another try simply to be disappointed yet again.,2025-03-11 20:18:13,1,0,0.0,Codeium,Mistuhlil,False,Reddit (r/Codeium),https://www.reddit.com/r/Codeium/comments/1j8t0y2/extreme_frustration_with_windsurf_flow/mhbrtb0/
1j4zqq6,Does Windsurf have 'restore checkpoints' similar to Cursor & Lovable?,"Im wondering if Im not just seeing it anywhere or if theres some other type of system besides the diffs that help you quickly go back and forth between different versions. Lovable's I would say is superior. cursor if you go back you cant go forward once you use that chat again. If not, what do you guys do beside basic git stuff?

EDIT:

Thank you to [Ancient-Camel1636](https://www.reddit.com/user/Ancient-Camel1636/) below, found that if you hover over your previous message an arrow comes up and allows you to restore to that message point. The feature is called 'Revert' on windsurf.",2025-03-06 08:42:15,4,12,1.0,Codeium,Matthiasiam,True,Reddit (r/Codeium),https://www.reddit.com/r/Codeium/comments/1j4zqq6/does_windsurf_have_restore_checkpoints_similar_to/
mggdmez,,"Yes discard really does not work well when you get too past maybe 5 edits. It's a shame though, I am finding Windsurf to be really frustrating right now due to bugs like this. Claude 3.7 performing endless edit suggestions, for instance.",2025-03-06 19:59:20,1,0,0.0,Codeium,dustfirecentury,False,Reddit (r/Codeium),https://www.reddit.com/r/Codeium/comments/1j4zqq6/does_windsurf_have_restore_checkpoints_similar_to/mggdmez/
mgcyb34,,"No, that's something entirely different.

I'm not currently using Windsurf due to all the bugs it has, so I can't remember exactly what the button tooltip says, but it's something you can click for every part of the chat (every time you have typed something in the chat), not only once per chat window. It's very useful.

Edit: Found this on their website:

https://preview.redd.it/u2j82imlr3ne1.png?width=744&format=png&auto=webp&s=6e475b38ac884021a8a282856ad6e1a6ed4ddb9f",2025-03-06 09:13:25,3,0,0.0,Codeium,Ancient-Camel1636,False,Reddit (r/Codeium),https://www.reddit.com/r/Codeium/comments/1j4zqq6/does_windsurf_have_restore_checkpoints_similar_to/mgcyb34/
1j9pd4b,Windsurf burns through credits by continuously correcting itself,"In this state this hardly more than a fun gimmick. I've tried four different project types now (composing a bash script, setting op a small Spring Boot project, setting up a React/Zustand based web UI and some CUDA code) and in all cases it just loses track once you get beyond even the smallest of setups. As I type this it's in a 20 step flow of fixing a bash script, run it, see a problem, claim it fixed it, run it, same problem, tries variant it already tried. Whatever the combination of memory, attention and model is causing this behavior is unclear to me. I've upgraded a few hours ago and I've burnt through 15% of my total monthly budget. And that's ignoring the fact that it bails on generating edits about 30% of the time with an error (I suspect due to the large size of the scripts it created and them being too large an amount of input tokens for an edit or just service outages, hard to say). Is anyone actually using this for production level codebases? Also, any model other than Claud is doing this thing where it suggests a fix without actually editing the files until you tell it something like ""do it"". 

P.S. It would be an interesting optimization to have some sort of (non LLM/ML based) short term history of generated content so it can avoid burning credits on generating the same command line invocations over and over again. As per the above mine is continuously doing a fix and then ""Let me run our updated script that now properly handles project IDs and follows our standardized service account structure:"" which has been the same bash command for about an hour now.",2025-03-12 10:20:13,21,8,1.0,Codeium,SignificantPhrase635,True,Reddit (r/Codeium),https://www.reddit.com/r/Codeium/comments/1j9pd4b/windsurf_burns_through_credits_by_continuously/
mhj6zh7,,"Who here is putting in effort on making a free self-hosted WindSurf open-source alternative?

I know I am....",2025-03-13 01:20:43,1,0,0.0,Codeium,Stoisss,False,Reddit (r/Codeium),https://www.reddit.com/r/Codeium/comments/1j9pd4b/windsurf_burns_through_credits_by_continuously/mhj6zh7/
mhj7478,,"We would need to Windsurf people to show us that they are not.... You can say anything, but show us that you have our ""your customers"" interest in mind, then we will come..",2025-03-13 01:22:07,1,0,0.0,Codeium,Stoisss,False,Reddit (r/Codeium),https://www.reddit.com/r/Codeium/comments/1j9pd4b/windsurf_burns_through_credits_by_continuously/mhj7478/
mhf8zw8,,"It should consume less, because if it has to consume a credit to try a solution that has already been tried before, it should be something like ""I see in the memories that this solution has already been tried and it doesn't work, so let's continue investigating the problem to find a valid solution..."" and so yes, it could still burn a lot of credits to find a solution, but you make sure that it always tries different attempts, instead of always trying the same things (which obviously will never work).


There is no way to control Claude's credit consumption, I don't think even the Codeium team can do much about it, it really depends on how the AI ​​was developed, so it should be Anthropic who manages it.",2025-03-12 10:59:58,1,0,0.0,Codeium,Agrume303,False,Reddit (r/Codeium),https://www.reddit.com/r/Codeium/comments/1j9pd4b/windsurf_burns_through_credits_by_continuously/mhf8zw8/
mhf9npu,,"Fair enough. And yes I recognize it's primarily a model issue but Codeium is sort of selling flow development as a product so I'd hope/think some sort of prompt engineering or whatever is used/optimized for this usecase. Anyway, thanks for your input.",2025-03-12 11:03:07,3,0,0.0,Codeium,SignificantPhrase635,False,Reddit (r/Codeium),https://www.reddit.com/r/Codeium/comments/1j9pd4b/windsurf_burns_through_credits_by_continuously/mhf9npu/
1j9ihak,Windsurf Not Working Today,"Edit files not working, atleast give us notification to not use windsurf if have issues. So it can save time and credit.",2025-03-12 05:05:09,20,6,0.96,Codeium,Pleasant_Key9761,True,Reddit (r/Codeium),https://www.reddit.com/r/Codeium/comments/1j9ihak/windsurf_not_working_today/
1j59yos,Why is MCP not available in windsurf on Mac?,"Is this just my problem or something specific to the Mac edition?   
I don't see the little hammer icon and the MCP section is missing from my settings?  
Is it related to my Teams license? Is this something the Team admin controls?",2025-03-06 15:54:10,3,8,0.81,Codeium,Fresh-Bit7420,True,Reddit (r/Codeium),https://www.reddit.com/r/Codeium/comments/1j59yos/why_is_mcp_not_available_in_windsurf_on_mac/
1j92z37,Windsurf Community Referral Challenge 🎧🔥 Rules below👇,"Want to earn 500 flex credits? Refer a friend through our new referral program. 

If you refer someone who subscribes to Pro, you'll both get 500 bonus flex credits. No limit to how many people you can refer.

The person with the **most referrals** will win a *1 of 1 Custom Windsurf Airpods Pro Max headphones!

Refer via https://windsurf.ai/refer

Note: the contest runs until *March 31st!**",2025-03-11 15:01:39,9,6,0.92,Codeium,mattbergland,True,Reddit (r/Codeium),https://www.reddit.com/r/Codeium/comments/1j92z37/windsurf_community_referral_challenge_rules_below/
mhabsdc,,"And if you don't have one yet, you can use mine, and then share yours :D

[https://codeium.com/refer?referral\_code=56f2413f00](https://codeium.com/refer?referral_code=56f2413f00)",2025-03-11 15:31:43,-2,0,0.0,Codeium,Thr8trthrow,False,Reddit (r/Codeium),https://www.reddit.com/r/Codeium/comments/1j92z37/windsurf_community_referral_challenge_rules_below/mhabsdc/
mhafcco,,"Another referral code:  
[https://codeium.com/refer?referral\_code=09908c5e49](https://codeium.com/refer?referral_code=09908c5e49)",2025-03-11 15:49:09,-2,0,0.0,Codeium,gekeli,False,Reddit (r/Codeium),https://www.reddit.com/r/Codeium/comments/1j92z37/windsurf_community_referral_challenge_rules_below/mhafcco/
mhahk72,,If you are new on Windsurf and want to get free 500 flex credits just click here: https://codeium.com/refer?referral_code=ca2f7fae35 <= (discount code inside),2025-03-11 16:00:03,-2,0,0.0,Codeium,valentino99,False,Reddit (r/Codeium),https://www.reddit.com/r/Codeium/comments/1j92z37/windsurf_community_referral_challenge_rules_below/mhahk72/
1j5iczx,"windsurf next, import from windsurf","I just downloaded windsurf next and it starts as a new app. when then there's the onboarding, theres's no posssibility to import the settings and extensions from windsurf.

how can i do that? ",2025-03-06 23:51:54,4,5,0.84,Codeium,esseti,True,Reddit (r/Codeium),https://www.reddit.com/r/Codeium/comments/1j5iczx/windsurf_next_import_from_windsurf/
1j66rw0,"[Referral mega thread] New to Windsurf, get 500 Flex credits. The referee also gets 500 Flex credits.","More details about the referral program: [https://codeium.com/refer](https://codeium.com/refer)  
  
Mods, please delete this if it is not appropriate.

This is my referral link if you want to support me:  [https://codeium.com/refer?referral\_code=09908c5e49](https://codeium.com/refer?referral_code=09908c5e49)  
  
  
Share your referral links below.",2025-03-07 18:13:20,7,4,1.0,Codeium,gekeli,True,Reddit (r/Codeium),https://www.reddit.com/r/Codeium/comments/1j66rw0/referral_mega_thread_new_to_windsurf_get_500_flex/
mgxywfb,,"Another here: [https://codeium.com/refer?referral\_code=39c11860f8](https://codeium.com/refer?referral_code=39c11860f8)  
Credits go towards writing a good roleplay that uses Claude!  :)",2025-03-09 17:25:33,1,0,0.0,Codeium,Jethro_E7,False,Reddit (r/Codeium),https://www.reddit.com/r/Codeium/comments/1j66rw0/referral_mega_thread_new_to_windsurf_get_500_flex/mgxywfb/
mgrxc9v,,[https://codeium.com/refer?referral\_code=1pt1yknk6drxgesl](https://codeium.com/refer?referral_code=1pt1yknk6drxgesl),2025-03-08 16:47:52,1,0,0.0,Codeium,Difficult-Tax-1008,False,Reddit (r/Codeium),https://www.reddit.com/r/Codeium/comments/1j66rw0/referral_mega_thread_new_to_windsurf_get_500_flex/mgrxc9v/
1j81jz9,Windsurf terminals doesnt work.,"Like the title says, my agent cant use terminal it doesn't generate any output. How can i fix it?",2025-03-10 08:41:00,2,4,1.0,Codeium,Sakuletas,True,Reddit (r/Codeium),https://www.reddit.com/r/Codeium/comments/1j81jz9/windsurf_terminals_doesnt_work/
1j8rebg,WindSurf works well with astro and tailwindcss 4,"I have my blog for some time in astro and with tailwindcss v4 wanted to do a refresh so wanted to give windsurf a try. in 2-3 days I build the blog from scratch with windsurf, it's the best tool that AI used so far for coding and use it for specific things and I tried a few, basically all that exists I have created an article with a video with some details here: [https://www.bitdoze.com/windsurd-build-astro-blog/](https://www.bitdoze.com/windsurd-build-astro-blog/)",2025-03-11 06:59:19,8,3,0.91,Codeium,bitdoze,True,Reddit (r/Codeium),https://www.reddit.com/r/Codeium/comments/1j8rebg/windsurf_works_well_with_astro_and_tailwindcss_4/
1j6nmxz,Client windsurf: connection to server is erroring. Shutting down server.,"anyone had this issue? it was working a few hours.  support said the service is working fine,  although reading through the comments, from 2 months ago this error has been there before.

I assume if it was a global issue though there would be more complaints on reddit? :) 

any ideas?

    [Error - 10:32:02 PM] Stopping server failed
      Message: Cannot call write after a stream was destroyed
      Code: -32099 
    [Error - 10:32:02 PM] Stopping server failed
      Message: Cannot call write after a stream was destroyed
    ",2025-03-08 10:34:51,1,4,1.0,Codeium,Uo98eq99mmo,True,Reddit (r/Codeium),https://www.reddit.com/r/Codeium/comments/1j6nmxz/client_windsurf_connection_to_server_is_erroring/
mgsqzaf,,delete the .windsurf directory,2025-03-08 19:52:29,1,0,0.0,Codeium,Thin-Ebb-777,False,Reddit (r/Codeium),https://www.reddit.com/r/Codeium/comments/1j6nmxz/client_windsurf_connection_to_server_is_erroring/mgsqzaf/
mgsxp6a,,"ok i randomly clicked on different things under advanced settings - it fixed it.   detect proxy i turned on.

from chatgpt  
Enabling “Detect Proxy” effectively forces Windsurf to reload its network settings and environment. If you were behind a firewall or proxy—or if Windsurf’s network detection had gotten stuck—toggling that setting can refresh its connection logic. In other words, when you switch on “Detect Proxy,” Windsurf does a fresh check for how it should connect to servers. This can sometimes fix issues where the software was not properly detecting your network configuration or was stuck in a “loading” loop.

https://preview.redd.it/0ukyupm4flne1.png?width=802&format=png&auto=webp&s=63ad55b6ae72a3d130162b8a1ee1659f7011dec0",2025-03-08 20:39:01,1,0,0.0,Codeium,Uo98eq99mmo,False,Reddit (r/Codeium),https://www.reddit.com/r/Codeium/comments/1j6nmxz/client_windsurf_connection_to_server_is_erroring/mgsxp6a/
1j7kmhk,looking for WindsurfUserSetup-x64-1.4.3.exe an WindsurfUserSetup-x64-1.3.11.exe,"i'm looking for 2 older release of windsurf   
WindsurfUserSetup-x64-1.4.3.exe   
and WindsurfUserSetup-x64-1.3.11.exe   
any help?",2025-03-09 16:17:31,1,3,1.0,Codeium,dave-lon,True,Reddit (r/Codeium),https://www.reddit.com/r/Codeium/comments/1j7kmhk/looking_for_windsurfusersetupx64143exe_an/
mgzrxv7,,[https://windsurf-stable.codeiumdata.com/win32-x64-user/stable/0f80b7c19f8b1378a97a1304da23b6b06e767db0/WindsurfUserSetup-x64-1.3.11.exe](https://windsurf-stable.codeiumdata.com/win32-x64-user/stable/0f80b7c19f8b1378a97a1304da23b6b06e767db0/WindsurfUserSetup-x64-1.3.11.exe) (from other post on forum). After installing instantly upgrades to newest 1.4.4,2025-03-10 01:53:21,3,0,0.0,Codeium,errorazz,False,Reddit (r/Codeium),https://www.reddit.com/r/Codeium/comments/1j7kmhk/looking_for_windsurfusersetupx64143exe_an/mgzrxv7/
1j591qv,Windsurf ignores proxy settings,After latest updates Windsurf ignores HTTP\_PROXY and HTTPS\_PROXY env vars. As well as setting in Application->Proxy. Toggling proxy detection in Windsurf settings has n o effect. In 1.3.11 works just fine.,2025-03-06 15:12:12,2,3,1.0,Codeium,ffmeat,True,Reddit (r/Codeium),https://www.reddit.com/r/Codeium/comments/1j591qv/windsurf_ignores_proxy_settings/
mgf8o1n,,"Try updating to 1.4.4 -- it should be fixed. Check your Windsurf Settings to ensure ""Enable Proxy"" is checked on.

https://preview.redd.it/3k7omdkpq5ne1.png?width=1272&format=png&auto=webp&s=8a34081b2e0c7ca704070eeb6c678a37c5a4404d",2025-03-06 15:54:56,1,0,0.0,Codeium,Silent-Grade-7786,False,Reddit (r/Codeium),https://www.reddit.com/r/Codeium/comments/1j591qv/windsurf_ignores_proxy_settings/mgf8o1n/
1j8938t,What is a Windsurf Workspace? Is it a folder? Where are the workspaces? Can you see a list of workspaces?,"What is a Windsurf Workspace? Is it a folder? Where are the workspaces? Can you see a list of workspaces? 

Can someone define what a workspace is in the context of Windsurf? Is it a folder? There are several operations one can do with workspaces: Open workspace from file, Add folder to workspace, Save workspace as, and duplicate workspace. Apparently you can have more than one workspace. Is there a place that shows a list of workspaces? There is an"" open workspace from file"", but no plain ""open workspace"" that would list multiple workspaces and let you pick one to open. I asked the AI in the Windsurf docs and it was not useful at all",2025-03-10 13:52:09,2,2,1.0,Codeium,ChuckBaggett,True,Reddit (r/Codeium),https://www.reddit.com/r/Codeium/comments/1j8938t/what_is_a_windsurf_workspace_is_it_a_folder_where/
mh60hqp,,This is a good answer. Windsurf is just a fork of VS Code and the concept of a workspace carries over from VS Code.,2025-03-11 00:25:46,3,0,0.0,Codeium,Equivalent_Pickle815,False,Reddit (r/Codeium),https://www.reddit.com/r/Codeium/comments/1j8938t/what_is_a_windsurf_workspace_is_it_a_folder_where/mh60hqp/
1j6lm2q,ChatGPT editing code in Windsurf vs Flow,"ChatGPT Mac app can now directly edit code in Windsurf vs using Flow. 

Benefits or negatives of either?

Thoughts? ",2025-03-08 09:05:24,2,2,1.0,Codeium,therickglenn,True,Reddit (r/Codeium),https://www.reddit.com/r/Codeium/comments/1j6lm2q/chatgpt_editing_code_in_windsurf_vs_flow/
mgpqx76,,"This looks great. I don't have a Mac... but if the GPT Mac app works like the web interface or the Android app, what I can deduce is that there are only advantages to using the app:


- GPT has a nice memories system, it works well, so you can set your whole context permanently, like it was Cascade or something...
that's what I did on the Android app to have an extra assistant, without consuming prompts in Windsurf, if I need ""premium advice"", I use GPT on Android for free.
(I gave it the exact same context that I gave Cascade).


- You use the LLM without intermediaries (Cascade) that can potentially reduce the quality of the LLM if the integration is not handled very well.


- You can directly edit the code instead of copying and pasting.


I wish they would do the same for Windows.",2025-03-08 09:39:01,1,0,0.0,Codeium,Agrume303,False,Reddit (r/Codeium),https://www.reddit.com/r/Codeium/comments/1j6lm2q/chatgpt_editing_code_in_windsurf_vs_flow/mgpqx76/
1ja6ohv,Windsurf / Codeium Referral Code: zobg1fmh75qr0pem,"If anyone is looking for a referral code, here's one:

[https://codeium.com/refer?referral\_code=zobg1fmh75qr0pem](https://codeium.com/refer?referral_code=zobg1fmh75qr0pem)",2025-03-13 00:39:34,0,1,0.5,Codeium,Maleficent_Exam4291,True,Reddit (r/Codeium),https://www.reddit.com/r/Codeium/comments/1ja6ohv/windsurf_codeium_referral_code_zobg1fmh75qr0pem/
1ja0dgh,Windsurf Bug Report: AI Agent Hangs During Composer Install Due to Unanswered Interactive Prompt,"Almost seems to happen on any script or command that needs interactive mode when ran by Windsurf.  

100% happy to be proven wrong.  
",2025-03-12 18:16:11,1,0,1.0,Codeium,sherbet_warrior,True,Reddit (r/Codeium),https://www.reddit.com/r/Codeium/comments/1ja0dgh/windsurf_bug_report_ai_agent_hangs_during/
1j89927,Is it possible to use Windsurf Previews with Cypress e2e framework?,"If you're familiar with Cypress, when configured to open Chrome, it opens it's own browser instance which proxies everything through `/__/#/` path (smth. like `http://localhost:4000/__/#/specs`)  to it's own internal server. And this instance runs the e2e tests. [Link](https://docs.cypress.io/app/guides/cross-origin-testing#What-Cypress-does-under-the-hood)

Unfortunately, it's not possible to open this url through external browser, therefore it's not possible to provide the Cascade with better context.

There's also no MCP for Cypress in sight, unfortunately.

I know that the best solution would be to move to Playwright, but the project I work at has thousands of Cypress tests already. 

If someone knows a way to make it work, I'd really appreciate any advice.",2025-03-10 13:59:02,2,0,1.0,Codeium,sh0plifter,True,Reddit (r/Codeium),https://www.reddit.com/r/Codeium/comments/1j89927/is_it_possible_to_use_windsurf_previews_with/
1j7rugp,How to Stop Autocomplete from Suggesting Certain Words in Windsurf?,"Hey everyone,

I’m a Korean developer, and I often need to use Korean text in README files, comments, or certain constant values.

Lately, I’ve been trying to tweak Windsurf’s memories to stop autocomplete from suggesting Korean text, but no matter how many rules I set, it still keeps popping up. It seems like those rules don’t actually affect autocomplete behavior.

Does anyone know if there’s a way to filter out specific words from autocomplete or control what gets suggested?

Any insights would be really helpful. Thanks!",2025-03-09 22:50:04,1,0,1.0,Codeium,Ho_park,True,Reddit (r/Codeium),https://www.reddit.com/r/Codeium/comments/1j7rugp/how_to_stop_autocomplete_from_suggesting_certain/
